"If you wanna run away with me, I know a galaxy
And I can take you for a ride
I had a premonition that we fell into a rhythm
Where the music don't stop for life
Glitter in the sky, glitter in my eyes
Shining just the way I like
If you're feeling like you need a little bit of company
You met me at the perfect time
You want me, I want you, baby
My sugarboo, I'm levitating
The Milky Way, we're renegading
Yeah, yeah, yeah, yeah, yeah
I got you, moonlight, you're my starlight
I need you all night, come on, dance with me
I'm levitating
You, moonlight, you're my starlight (you're the moonlight)
I need you all night, come on, dance with me
I'm levitating
I believe that you're for me, I feel it in our energy
I see us written in the stars
We can go wherever, so let's do it now or never, baby
Nothing's ever, ever too far
Glitter in the sky, glitter in our eyes
Shining just the way we are
I feel like we're forever, every time we get together
But whatever, let's get lost on Mars
You want me, I want you, baby
My sugarboo, I'm levitating
The Milky Way, we're renegading
Yeah, yeah, yeah, yeah, yeah
I got you, moonlight, you're my starlight
I need you all night, come on, dance with me
I'm levitating
You, moonlight, you're my starlight (you're the moonlight)
I need you all night, come on, dance with me
I'm levitating (woo)
You can fly away with me tonight
You can fly away with me tonight
Baby, let me take you for a ride
Yeah, yeah, yeah, yeah, yeah
I'm levitating (woo)
You can fly away with me tonight
You can fly away with me tonight
Baby, let me take you for a ride
Yeah, yeah, yeah, yeah, yeah (woo)
My love is like a rocket, watch it blast off
And I'm feeling so electric, dance my arse off
And even if I wanted to, I can't stop
Yeah, yeah, yeah, yeah, yeah
My love is like a rocket, watch it blast off
And I'm feeling so electric, dance my arse off
And even if I wanted to, I can't stop
Yeah, yeah, yeah, yeah, yeah
You want me, I want you, baby
My sugarboo, I'm levitating
The Milky Way, we're renegading
I got you (yeah), moonlight, you're my starlight
I need you all night (all night), come on, dance with me
I'm levitating (woo)
You can fly away with me tonight (tonight)
You can fly away with me tonight
Baby, let me take you for a ride
Yeah, yeah, yeah, yeah, yeah (take you for a ride)
I'm levitating (woo)
You can fly away with me tonight (tonight)
You can fly away with me tonight
Baby, let me take you for a ride
Yeah, yeah, yeah, yeah, yeah (let me take you for a ride)
I got you, moonlight, you're my starlight (you are my starlight)
I need you all night, come on, dance with me (come on, dance with me, baby)
I'm levitating
You, moonlight, you're my starlight (you're the moonlight)
I need you all night, come on, dance with me
I'm levitating"
"Ooh
Na-na, yeah
I saw you dancing in a crowded room
You look so happy when I'm not with you
But then you saw me, caught you by surprise
A single teardrop falling from your eye
I don't know why I run away
I'll make you cry when I run away
You could've asked me why I broke your heart
You could've told me that you fell apart
But you walked past me like I wasn't there
And just pretended like you didn't care
I don't know why I run away
I'll make you cry when I run away
Take me back 'cause I wanna stay
Save your tears for another
Save your tears for another day
Save your tears for another day
So, I made you think that I would always stay
I said some things that I should never say
Yeah, I broke your heart like someone did to mine
And now you won't love me for a second time
I don't know why I run away, oh, girl
Said I'll make you cry when I run away
Girl, take me back 'cause I wanna stay
Save your tears for another
I realize that I'm much too late
And you deserve someone better
Save your tears for another day (ooh, yeah)
Save your tears for another day (yeah)
I don't know why I run away
I'll make you cry when I run away
Save your tears for another day, ooh, girl (ah)
I said save your tears for another day (ah)
Save your tears for another day (ah)
Save your tears for another day (ah)"
"Yeah
I've been tryna call
I've been on my own for long enough
Maybe you can show me how to love, maybe
I'm going through withdrawals
You don't even have to do too much
You can turn me on with just a touch, baby
I look around and
Sin City's cold and empty (oh)
No one's around to judge me (oh)
I can't see clearly when you're gone
I said, ooh, I'm blinded by the lights
No, I can't sleep until I feel your touch
I said, ooh, I'm drowning in the night
Oh, when I'm like this, you're the one I trust
(Hey, hey, hey)
I'm running out of time
'Cause I can see the sun light up the sky
So I hit the road in overdrive, baby, oh
The city's cold and empty (oh)
No one's around to judge me (oh)
I can't see clearly when you're gone
I said, ooh, I'm blinded by the lights
No, I can't sleep until I feel your touch
I said, ooh, I'm drowning in the night
Oh, when I'm like this, you're the one I trust
I'm just walking by to let you know (by to let you know)
I can never say it on the phone (say it on the phone)
Will never let you go this time (ooh)
I said, ooh, I'm blinded by the lights
No, I can't sleep until I feel your touch
(Hey, hey, hey)
I said, ooh, I'm blinded by the lights
No, I can't sleep until I feel your touch"
"Oh-oh-oh
Yeah, yeah, yeah, yeah (yeah)
Why you always in a mood?
Fuckin' 'round, actin' brand new
I ain't tryna tell you what to do
But try to play it cool
Baby, I ain't playing by your rules
Everything look better with a view
Why you always in a mood?
Fuckin' 'round, actin' brand new
I ain't tryna tell you what to do
But try to play it cool
Baby, I ain't playing by your rules
Everything look better with a view, yeah
I could never get attached
When I start to feel, I unattach
Somehow always end up feeling bad
Baby, I am not your dad, it's not all you want from me
I just want your company
Girl, it's obvious, elephant in the room
And we're a part of it, don't act so confused
And you love startin' it, now I'm in a mood
Now we arguin' in my bedroom
We play games of love to avoid the depression
We been here before
And I won't be your victim
Why you always in a mood?
Fuckin' 'round, actin' brand new
I ain't tryna tell you what to do
But try to play it cool
Baby, I ain't playing by your rules
Everything look better with a view
Why you always in a mood?
Fuckin' 'round, actin' brand new
I ain't tryna tell you what to do
But try to play it cool
Baby, I ain't playing by your rules
Everything look better with a view
So why you tryin' to fake your love on the regular?
When you could be blowin' up just like my cellular
I won't ever let a shorty go and set me up
Only thing I need to know is if you wet enough
I'm talking slick back, kick back, gang sippin' Fourties
You keep playin', not another day with you shorty
Mismatch, bitch, that was way before you know me
Got a lot of love, well you better save it for me
We play games of love to avoid the depression
We been here before
And I won't be your victim
Why you always in a mood?
Fuckin' 'round, actin' brand new
I ain't tryna tell you what to do
But try to play it cool
Baby, I ain't playing by your rules
Everything look better with a view
Why you always in a mood?
Fuckin' 'round, actin' brand new
I ain't tryna tell you what to do
But try to play it cool
Baby, I ain't playing by your rules
Everything look better with a view, yeah"
"Well, good for you, I guess you moved on really easily
You found a new girl, and it only took a couple weeks
Remember when you said that you wanted to give me the world? (World?)
And good for you, I guess that you've been working on yourself
I guess that therapist I found for you, she really helped
Now you can be a better man for your brand-new girl (girl)
Well, good for you, you look happy and healthy
Not me, if you ever cared to ask
Good for you, you're doing great out there without me, baby
God, I wish that I could do that
I've lost my mind, I've spent the night crying on the floor of my bathroom
But you're so unaffected, I really don't get it
But I guess good for you
Well, good for you, I guess you're getting everything you want (ah)
You bought a new car and your career's really taking off (ah)
It's like we never even happened
Baby, what the fuck is up with that? (Ha)
And good for you, it's like you never even met me
Remember when you swore to God I was the only person who ever got you?
Well, screw that and screw you
You will never have to hurt the way you know that I do
Well, good for you, you look happy and healthy
Not me, if you ever cared to ask
Good for you, you're doing great out there without me, baby
God, I wish that I could do that
I've lost my mind, I've spent the night crying on the floor of my bathroom
But you're so unaffected, I really don't get it
But I guess good for you
Ah-ah-ah-ah
Ah-ah-ah-ah
Maybe I'm too emotional
But your apathy is like a wound in salt
Maybe I'm too emotional
Or maybe you never cared at all
Maybe I'm too emotional
Your apathy is like a wound in salt
Maybe I'm too emotional
Or maybe you never cared at all
Well, good for you, you look happy and healthy
Not me, if you ever cared to ask
Good for you, you're doing great out there without me, baby
Like a damn sociopath!
I've lost my mind, I've spent the night crying on the floor of my bathroom
But you're so unaffected, I really don't get it
But I guess good for you
Well, good for you, I guess you moved on really easily"
"We hug and yes, we make love
And always just say ""Goodnight"" (la-la-la-la-la)
And we cuddle, sure, I do love it
But I need your lips on mine
Can you kiss me more?
We're so young, boy
We ain't got nothin' to lose, oh, oh
It's just principle
Baby, hold me
'Cause I like the way you groove, oh, oh
Boy, you write your name, I can do the same
Ooh, I love the taste, la-la-la-la
All on my tongue, I want it (la-la-la-la)
Boy, you write your name, I can do the same
Ooh, I love the taste, la-la-la-la-la
All on my tongue, I want it
I, I feel like fuckin' somethin'
But we could be corny, fuck it
Sugar, I ain't no dummy, dummy
I like to say, ""What if?"", but if
We could kiss and just cut the rubbish
Then I might be on to somethin'
I ain't givin' you one in public
I'm givin' you hundreds, fuck it
Somethin' we just gotta get into
Sign first, middle, last, on the wisdom tooth
Niggas wishin' that the pussy was a kissin' booth
Taste breakfast, lunch and gin and juice
And that dinner just like dessert too
And when we French, refresh, gimme two
When I bite that lip, come get me too
He want lipstick, lip gloss, hickeys too, huh
Can you kiss me more?
We're so young, boy
We ain't got nothin' to lose, oh, oh
It's just principle
Baby, hold me
'Cause I like the way you groove, oh, oh
Boy, you write your name, I can do the same
Ooh, I love the taste, la-la-la-la
All on my tongue, I want it (la-la-la-la)
Boy, you write your name, I can do the same
Ooh, I love the taste, la-la-la-la-la
All on my tongue, I want it
Say give me a buck, need that gushy stuff
Push the limit, no, you ain't good enough
All your niggas say that you lost without me
All my bitches feel like I dodged the county
Fuckin' with you feel like jail, nigga (feel like jail)
I can't even exhale, nigga (exhale)
Pussy like holy grail, you know that
You gon' make me need bail, you know that
Caught dippin' with your friend
You ain't even half man, lyin' on ya-, you know that
Got me a bag full of brick, you know that
Control, don't slow the pace if I throw back
All this ass for real (all this ass)
Drama make you feel (make you feel)
Fantasy and whip appeal
Is all I can give you
Can you kiss me more?
We're so young, boy
We ain't got nothin' to lose, oh, oh
It's just principle
Baby, hold me
'Cause I like the way you groove, oh, oh
Oh, darlin'
Boy, you write your name, I can do the same
Ooh, I love the taste, oh-la-la-la-la
All on my tongue, I want it
Boy, you write your name, I can do the same
Ooh, I love the taste, oh-la-la-la-la-la
All on my tongue, I want it"
"Said baby, said baby, said baby
What you doing? (What you doing?)
Where you at? (Where you at?)
Oh, you got plans? (You got plans?)
Don't say that (shut your trap)
I'm sipping wine (sip, sip) in a robe (drip, drip)
I look too good (look too good) to be alone (woo-woo)
My house clean (house clean), my pool warm (pool warm)
Just shaved (smooth like a newborn)
We should be dancing, romancing
In the east wing and the west wing
Of this mansion, what's happening?
I ain't playing no games
Every word that I say is coming straight from the heart
So if you tryna lay in these arms
I'ma leave the door open
(I'ma leave the door open)
I'ma leave the door open, girl
(I'ma leave the door open, hoping)
That you feel the way I feel
And you want me like I want you tonight, baby
(Tell me that you're coming through)
Ooh, you're so sweet (so sweet), so tight (so tight)
I won't bite (ah-ah), unless you like (unless you like)
If you smoke (what you smoke?) I got the haze (Purple Haze)
And if you're hungry, girl, I got filets (woo-woo)
Ooh, baby, don't keep me (waiting)
There's so much love we could be making (shamone)
I'm talking kissing, cuddling
Rose petals in the bathtub
Girl, let's jump in, it's bubbling
I ain't playing no games
Every word that I say is coming straight from the heart
So (if you) if you (tryna) tryna lay in these arms
I'ma leave the door open
(I'ma leave the door open)
I'ma leave the door open, girl
(I'ma leave the door open, hoping)
That you feel the way I feel
And you want me like I want you tonight, baby
(Tell me that you're coming through) come on, girl
La-la-la, la-la-la-la (I need you, baby)
La-la-la, la-la-la-la (I gotta see you, baby)
La-la-la, la-la-la-la (girl, I'm tryna give you this)
Ah-ah-ah-ah, ah-ah
Hey-hey, I'ma leave my door open, baby (I'ma leave the door open)
I'ma leave, I'ma leave my door open, girl
(I'ma leave the door open, hoping) and I'm hoping, hoping
That you feel the way I feel
And you want me like I want you tonight, baby
(Tell me that you're coming through) woo!
La-la-la, la-la-la-la (tell me)
(Tell me that you're coming through)
Woo-woo-woo-woo, woo-woo-woo, woo-woo-woo
Woo-woo-woo-woo, woo-woo-woo, woo-woo
La-la-la, la-la-la-la (la-la-la, la-la)
(Tell me that you're coming through)
Girl, I'm here just waiting for you (oh!)
Come on over, I'll adore you (I gotta know!)
La-la-la, la-la-la-la (I'm waiting, waiting, waiting)
(Tell me that you're coming through) for you
Girl, I'm here just waiting for you
Come on over, I'll adore you
La-la-la, la-la-la-la (la-la, la-la)"
"I got my driver's license last week
Just like we always talked about
'Cause you were so excited for me
To finally drive up to your house
But today I drove through the suburbs
Cryin' 'cause you weren't around
And you're probably with that blonde girl
Who always made me doubt
She's so much older than me
She's everything I'm insecure about
Yeah, today I drove through the suburbs
'Cause how could I ever love someone else?
And I know we weren't perfect but I've never felt this way for no one
And I just can't imagine how you could be so okay now that I'm gone
Guess you didn't mean what you wrote in that song about me
'Cause you said forever, now I drive alone past your street
And all my friends are tired
Of hearing how much I miss you, but
I kinda feel sorry for them
'Cause they'll never know you the way that I do, yeah
Today I drove through the suburbs
And pictured I was driving home to you
And I know we weren't perfect
But I've never felt this way for no one, oh
And I just can't imagine how you could be so okay now that I'm gone
I guess you didn't mean what you wrote in that song about me
'Cause you said forever, now I drive alone past your street
Red lights, stop signs
I still see your face in the white cars, front yards
Can't drive past the places we used to go to
'Cause I still fuckin' love you, babe (ooh, ooh, ooh, ooh)
Sidewalks we crossed
I still hear your voice in the traffic, we're laughing
Over all the noise
God, I'm so blue, know we're through
But I still fuckin' love you, babe (ooh, ooh, ooh, ooh)
I know we weren't perfect but I've never felt this way for no one
And I just can't imagine how you could be so okay now that I'm gone
'Cause you didn't mean what you wrote in that song about me
'Cause you said forever, now I drive alone past your street
Yeah, you said forever, now I drive alone past your street"
"I caught it bad yesterday
You hit me with a call to your place
Ain't been out in a while anyway
Was hoping I could catch you throwing smiles in my face
Romantic talking? You don't even have to try
You're cute enough to fuck with me tonight
Looking at the table and I see the reason why
Baby, you living the life, but nigga, you ain't livin' right
Cocaine and drinking with your friends
You live in the dark, boy, I cannot pretend
I'm not fazed, only here to sin
If Eve ain't in your garden, you know that you can
Call me when you want, call me when you need
Call me in the morning, I'll be on the way
Call me when you want, call me when you need
Call me out by your name, I'll be on the way like
Mmm, mmm, mmm, mmm
Mmm, mmm, mmm, mmm
Ayy, ayy
I wanna sell what you're buying
I wanna feel on yo' ass in Hawaii
I want that jet lag from fucking and flying
Shoot a child in your mouth while I'm riding
Oh, oh, oh, why me?
A sign of the times every time that I speak
A dime and a nine, it was mine every week
What a time, an incline, God was shining on me
Now I can't leave
And now I'm acting hella elite
Never want the niggas that's in my league
I wanna fuck the ones I envy, I envy
Cocaine and drinking with your friends
You live in the dark, boy, I cannot pretend
I'm not fazed, only here to sin
If Eve ain't in your garden, you know that you can
Call me when you want, call me when you need
Call me in the morning, I'll be on the way
Call me when you want, call me when you need
Call me out by your name, I'll be on the way like
Oh, call me by your name (mmm, mmm, mmm)
Tell me you love me in private
Call me by your name (mmm, mmm, mmm)
I do not care if you lying
Well, I'm just feeling, mm-uh
I wanna get, mm-uh
I'm in my, into my, uh
I'm mm, mm
I'm still, mm, mm-mm, ooh"
"I got my peaches out in Georgia (oh, yeah, shit)
I get my weed from California (that's that shit)
I took my chick up to the North, yeah (badass bitch)
I get my light right from the source, yeah (yeah, that's it)
And I see you (oh), the way I breathe you in (in), it's the texture of your skin
I wanna wrap my arms around you, baby, never let you go, oh
And I say, oh, there's nothing like your touch
It's the way you lift me up, yeah
And I'll be right here with you 'til the end
I got my peaches out in Georgia (oh, yeah, shit)
I get my weed from California (that's that shit)
I took my chick up to the North, yeah (badass bitch)
I get my light right from the source, yeah (yeah, that's it)
You ain't sure yet, but I'm for ya
All I could want, all I can wish for
Nights alone that we miss more
And days we save as souvenirs
There's no time, I wanna make more time
And give you my whole life
I left my girl, I'm in Mallorca
Hate to leave her, call it torture
Remember when I couldn't hold her
Left her baggage for Rimowa
I got my peaches out in Georgia (oh, yeah, shit)
I get my weed from California (that's that shit)
I took my chick up to the North, yeah (badass bitch)
I get my light right from the source, yeah (yeah, that's it)
I get the feeling, so I'm sure (sure)
Hand in my hand because I'm yours
I can't, I can't pretend, I can't ignore you're right for me
Don't think you wanna know just where I've been, oh
Done being distracted
The one I need is right in my arms (oh)
Your kisses taste the sweetest with mine
And I'll be right here with you 'til end of time
I got my peaches out in Georgia (oh, yeah, shit)
I get my weed from California (that's that shit)
I took my chick up to the North, yeah (badass bitch)
I get my light right from the source, yeah (yeah, that's it)
I got my peaches out in Georgia (oh, yeah, shit)
I get my weed from California (that's that shit)
I took my chick up to the North, yeah (badass bitch)
(I get my light right from the source, yeah, yeah)
I got my peaches out in Georgia (oh, yeah, shit)
I get my weed from California (that's that shit)
I took my chick up to the North, yeah (badass bitch)
I get my light right from the source, yeah (yeah, that's it)
I got my peaches out in Georgia (oh, yeah, shit)
I get my weed from California (that's that shit)
I took my chick up to the North, yeah (badass bitch)
I get my light right from the source, yeah (yeah, that's it)"
"Smooth like butter, like a criminal undercover
Gon' pop like trouble breaking into your heart like that (ooh)
Cool shade, stunner, yeah, I owe it all to my mother, uh
Hot like summer, yeah, I'm making you sweat like that (break it down!)
Ooh, when I look in the mirror
I'll melt your heart into two
I got that superstar glow, so
Ooh (do the boogie, like)
A side step, right-left, to my beat
High like the moon, rock with me, baby
Know that I got that heat
Let me show you 'cause talk is cheap
Side step, right-left, to my beat
Get it, let it roll
Smooth like butter, pull you in like no other
Don't need no Usher to remind me you got it bad
Ain't no other that can sweep you up like a robber
Straight up, I (got ya)
Making you fall like that (break it down)
Ooh, when I look in the mirror
I'll melt your heart into two
I got that superstar glow, so
Ooh (do the boogie, like)
Side step, right-left, to my beat
High like the moon, rock with me, baby
Know that I got that heat
Let me show you 'cause talk is cheap
A side step, right-left, to my beat
Get it, let it roll
Get it, let it roll
Get it, let it roll
Ice on my wrist, I'm the nice guy
Got the right body and the right mind
Rolling up the party, got the right vibe
Smooth like (butter), hate us (love us)
Fresh boy, pull up and we lay low
All the players get moving when the bass low
Got ARMY right behind us when we say so
Let's go
Side step, right-left, to my beat (right-left, to my beat)
High like the moon, rock with me, baby
You know that I got that heat
Let me show you 'cause talk is cheap (you know that talk is cheap)
Side step, right-left, to my beat
Get it, let it roll
Smooth like (butter), cool shade (stunner)
And you know we don't stop
Hot like (summer), ain't no (bummer)
You'll be like, ""Oh my God""
We gon' make you rock, and you say (yeah)
We gon' make you bounce, and you say (yeah)
Hotter, sweeter, cooler, butter!
Get it, let it roll"
"I do the same thing, I told you that I never would
I told you I changed, even when I knew I never could
I know that I can't find nobody else as good as you
I need you to stay, need you to stay, hey
I get drunk, wake up, I'm wasted still
I realize the time that I wasted here
I feel like you can't feel the way I feel
I'll be fucked up if you can't be right here
Oh-whoa (oh-whoa, oh-whoa)
Oh-whoa (oh-whoa)
Oh-whoa (oh-whoa)
I'll be fucked up if you can't be right here
I do the same thing, I told you that I never would
I told you I changed, even when I knew I never could
I know that I can't find nobody else as good as you
I need you to stay, need you to stay, hey
I do the same thing, I told you that I never would
I told you I changed, even when I knew I never could
I know that I can't find nobody else as good as you
I need you to stay, need you to stay, yeah
When I'm away from you, I miss your touch (ooh)
You're the reason I believe in love
It's been difficult for me to trust (ooh)
And I'm afraid that I'ma fuck it up
Ain't no way that I can leave you stranded
'Cause you ain't never left me empty-handed
And you know that I know that I can't live without you
So, baby, stay
Oh-whoa (oh-whoa, oh-whoa)
Oh-whoa (oh-whoa)
Oh-whoa (oh-whoa)
I'll be fucked up if you can't be right here
I do the same thing, I told you that I never would
I told you I changed, even when I knew I never could
I know that I can't find nobody else as good as you
I need you to stay, need you to stay, yeah
I do the same thing, I told you that I never would
I told you I changed, even when I knew I never could
I know that I can't find nobody else as good as you
I need you to stay, need you to stay, hey
Whoa-oh
I need you to stay, need you to stay, hey"
"Car rides to Malibu
Strawberry ice cream
One spoon for two
And trading jackets
Laughing 'bout how small it looks on you
(Ha-ha-ha-ha, ha-ha-ha-ha, ha-ha-ha-ha)
Watching reruns of Glee
Being annoying
Singing in harmony
I bet she's bragging
To all her friends, saying you're so unique, hmm
So when you gonna tell her
That we did that, too?
She thinks it's special
But it's all reused
That was our place, I found it first
I made the jokes you tell to her when she's with you
Do you get déjà vu when she's with you?
Do you get déjà vu? (Ah), hmm
Do you get déjà vu, huh?
Do you call her
Almost say my name?
'Cause let's be honest
We kinda do sound the same
Another actress
I hate to think that I was just your type
I'll bet that she knows Billy Joel
'Cause you played her ""Uptown Girl""
You're singing it together
Now I bet you even tell her
How you love her
In between the chorus and the verse (ooh) (I love you)
So when you gonna tell her
That we did that, too?
She thinks it's special
But it's all reused
That was the show we talked about
Played you the song she's singing now when she's with you
Do you get déjà vu when she's with you?
Do you get déjà vu? Oh
Do you get déjà vu?
Strawberry ice cream in Malibu
Don't act like we didn't do that shit, too
You're trading jackets like we used to do
(Yeah, everything is all reused)
Play her piano, but she doesn't know (oh, oh)
That I was the one who taught you Billy Joel (oh)
A different girl now, but there's nothing new
(I know you get déjà vu)"
