"What up, Nelly?
You ready to do another one, bruh?
Talk to 'em (uh, uh, uh, uh), haha
Yeah, runnin' all red lights
Pull up to the club, just to get, to get ahead, right
I do this shit er'ry night
You can call it limelight, I'ma call it my life
Shawty lookin' alright
TK jeans on, skin-skin-skintight
She be shakin' that taillight
Got me froze in the road like a deer in the headlights (uh, uh, yeah)
Oh, Backwoods, wanna know if you can roll
Got Cîroc on the rocks, ice-cold
Got the coupe on the new town road
Real low, oh
I know we just met, but, girl, let's roll
Let's roll, whoa, let's roll, let's roll
I'll go anywhere you wanna go
Let's go, oh
And she said, ""Take me to the country, show me where you from""
I said, ""Shawty, you gon' love me and we gon' have some fun""
I'll break out my big wheel and you can climb on up
Girl, I think you a big deal, now show your boy some love
Huh, just a lil' bit
Just a lil' bit (uh)
Just a lil' bit (yeah)
Just a lil' bit (uh)
We gon' have some fun
Just a lil' bit (uh)
Just a lil' bit (yeah)
Just a lil' bit
Yeah, we gon' have some-
Shawty messin' with a pro now (woo)
I'm a pro now
I'm the who, what, when, where to go now
Shows sold out
From the front to the back, hip-hop or the hoedown
Got the game on the go route
I'm the black Tom Brady in this, I'm the G.O.A.T. now (haha)
Shawty, I'm so wow
Orleans out to SoCal
Better know now
I know we just met, but, girl, let's roll
Let's roll, whoa, let's roll, let's roll
I'll go anywhere you wanna go
Let's go, oh (ayy, ayy, ayy)
And she said, ""Take me to the country, show me where you from"" (let's ride)
I said, ""Shawty, you gon' love me and we gon' have some fun""
I'll break out my big wheel and you can climb on up
Girl, I think you a big deal, now show your boy some love
Huh, just a lil' bit
Just a lil' bit (yeah, baby, uh)
Just a lil' bit (yeah)
Just a lil' bit (uh)
We gon' have some fun
Just a lil' bit (uh)
Just a lil' bit (yeah)
Just a lil' bit (haha, uh, yeah, yeah)
Oh, Backwoods, wanna know if you can roll
Got Cîroc on the rocks, ice-cold
Got the coupe on the new town road (uh, uh, uh)
Real low, oh
Oh, Backwoods, wanna know if you can roll (can she roll?)
Got Cîroc on the rocks, ice-cold
Got the coupe on the new town road
Real low, oh
And she said, ""Take me to the country, show me where you from""
I said, ""Shawty, you gon' love me and we gon' have some fun"" (we back, man)
I'll break out my big wheel and you can climb on up
Girl, I think you a big deal, now show your boy some love
Huh, just a lil' bit (ayy, ayy)
Just a lil' bit (come on, ayy, ayy)
Just a lil' bit (ayy, ayy)
Just a lil' bit
We gon' have some fun (ayy, ayy)
Just a lil' bit (ayy, ayy)
Just a lil' bit (ayy, ayy)
Just a lil' bit
We gon' have some fun"
"Hands on my knees, shakin' ass, on my thot shit
Post me a pic, finna make me a profit
When the liquor hit, then a bitch get toxic
(Why the fuck you in the club with niggas wildin'?)
I've been lit since brunch, thot shit
Order 42 for the table, let's pop shit
Missionary or doggystyle, I'ma top shit
Pussy-ass niggas hatin' on me from the closet, ah
Hoes tryna call me a snake, shit, I guess I can relate
'Cause a bitch spit a whole lotta venom
And since these hoes all rats, when they come around me
All I see is a whole lotta dinner
I walk around the house butt-naked
And I stop at every mirror just to stare at my own posterior
I don't give a fuck who talk behind my back
'Cause the bitch knew better than to let me hear her (ah)
Hands on my knees, shakin' ass, on my thot shit
Hands on my knees, shakin' ass, on my thot shit (thot shit)
Hands on my knees, shakin' ass, on my thot shit
Hands on my knees, ha-hands on my knees
Hands on my knees, shakin' ass, on my thot shit
Hands on my knees, shakin' ass, on my thot shit (thot shit)
Hands on my knees, shakin' ass, on my thot shit
Hands on my knees, hands on my knees
Hoes said they wish a bitch would, and I'm a genie
Bitch so hot, gotta stay in bikinis
He got a girl, but he keep beggin' to see me
I love it when a nigga got a mouth full of VVs
No, I'm not a patient, but I let him treat me
I gotta be a doctor how I'm orderin' CCs
Go to your place, no face, no case
Ninety-nine percent tint in a blacked-out Wraith
I remember hoes used to clap for me happily
Now I'm bossed up and them same hoes mad at me
Acting like they ridin', whole time tryna pass me
Watchin' me go through it, still tryna drag me
Actin' like you winnin', if you think about it, actually
Are they supportin' you or really just attackin' me?
I don't give a fuck 'bout a blog tryna bash me
I'm the shit per the Recording Academy (ah)
Hands on my knees, shakin' ass, on my thot shit
Hands on my knees, shakin' ass, on my thot shit (thot shit)
Hands on my knees, shakin' ass, on my thot shit
Hands on my knees, ha-hands on my knees
Hands on my knees, shakin' ass, on my thot shit
Hands on my knees, shakin' ass, on my thot shit (thot shit)
Hands on my knees, shakin' ass, on my thot shit
Hands on my knees, hands on my knees
Drinkin' out the motherfuckin' bottle on my thot shit
Everything I eat go straight to my pockets
2021, finna graduate college
Goth girl shit, I'm a real hot topic
Fuckin' on a nigga, make him sing, on some pop shit
I need a real headbanger, on some rock shit
Pussy like crack, wanna hit it like dope
Got a real hot box, but a bitch don't smoke (ah)
Hot girl, but I'm still the coldest, hey
I'm the big homie, but I ain't the oldest, hmm
Bitch dry hatin', tryna get noticed
Man, ain't nobody come to see you, Otis, look
How many bitches lyin' if they say they bars is better?
They really puppets, so I really gotta go and Geppetto
I'm really talkin', but it really can apply to whoever
My pen a freak, it'll go after a bitch or a nigga (huh)
Big bank take lil' bank, bitch, add it up
Hoes takin' shots, but they ain't in my caliber
Booked, but I squeeze a lil' head in my calendar
Lookin' in the mirror like, ""Damn, I don't brag enough""
LVs, Double C's, Birkins, I'm workin'
My chain ain't hittin' if a bitch ain't hurtin'
Look, I ain't even finna argue with a bitch
One thing I know, two things for certain
None of these hoes sayin' shit to my face
And none of these hoes finna see me at the bank
And I'ma keep talkin' all the shit that I want
And I dare one of these hoes come tell me I can't (can't)
We ain't even speakin' if the nigga ain't spendin'
He could never say that I was one of his women
I don't even let niggas know where I stay
I'll be damned if he thinkin' he poppin' up on this pimpin' (ah)
Hands on my knees, shakin' ass, on my thot shit
Hands on my knees, shakin' ass, on my thot shit (thot shit)
Hands on my knees, shakin' ass, on my thot shit
Hands on my knees, ha-hands on my knees
Hands on my knees, shakin' ass, on my thot shit
Hands on my knees, shakin' ass, on my thot shit (thot shit)
Hands on my knees, shakin' ass, on my thot shit
Hands on my knees, hands on my knees"
"Late at night
Kiss me in the mornin', late at night
Catch me drivin' down 405
Catch me and your girl late at night
Side to side
(Mustard on the beat, ho)
Late at night
Kiss me in the mornin' or late at night
Long as you come through
I'ma make you come over and over
I'ma treat you like I'm 'posed to
You better never make no time for these niggas
'Cause when I ride, I'ma ride, ride with you
I can't fuck with nobody
I can't keep livin' like this, I can't
I tell her what it is and I tell her what it ain't
She know that I been all in her walls like I paint
Told her at times I wanna give you trust but I can't
Bitch, I really got it out the mud, climbin' up the ranks
When they see me outside, I'm a high roller
I been on a global jet, but nigga, I fly solo
And I got the Gucci splattered all on her knick knacks
Fifty racks, I'm 'bout to break her off like a Kit-Kat
And her purse got F's like the wheels on the 'Bach
I just fucked off a million but I still got a sack
Shorty know that I'm the realest, she know I be speakin' facts
She know that I'm the same nigga that was pushin' 'Cat
She know I got the game but I'm never gon' give it back
Every time that we fuck, I gotta run it back
Late at night
Kiss me in the mornin' or late at night
Long as you come through
I'ma make you come over and over
I'ma treat you like I'm 'posed to
You better never make no time for these niggas
'Cause when I ride, I'ma ride, ride with you
I told shorty, never get too comfortable
I like to feel like the pussy untouchable
I like to feel like it's never goin' one way
I like to see your body drippin' Elliante
I say I like the way I took you on a wave
I had you screamin' my name out
Late at night
Kiss me in the mornin' or late at night
Long as you come through
I'ma make you come over and over
I'ma treat you like I'm 'posed to
You better never make no time for these niggas
'Cause when I ride, I'ma ride, ride with you
Ride, ride, ride, ride, ride, ride
Ride, ride, ride, ride, ride, ride
Ride, ride, ride, ride, ride
Ride, ride, ride, ride, ride, ride
Ride, ride, ride, ride, ride
Ride, ride, ride, ride, ride, ride
Ride, ride, ride, ride, ride
Ride, ride, ride, ride, ride"
"Dance with me under the diamonds
See me like breath in the cold
Sleep with me here in the silence
Come kiss me, silver and gold
You say that I won't lose you
But you can't predict the future
So, just hold on like you will never let go
Yeah, if you ever move on without me
I need to make sure you know that
You are the only one I'll ever love
(I gotta tell ya, gotta tell ya)
Yeah, you, if it's not you, it's not anyone
(I gotta tell ya, gotta tell ya)
Looking back on my life
You're the only good I've ever done (ever done)
Yeah, you, if it's not you, it's not anyone (anyone)
Not anyone
Forever's not enough time to (oh)
Love you the way that I want (love you the way that I want)
'Cause every morning I find you (oh)
I fear the day that I don't
You say that I won't lose you
But you can't predict the future
'Cause certain things are out of our control
Yeah, if you ever move on without me
I need to make sure you know that
You are the only one I'll ever love
Only one (I gotta tell ya, gotta tell ya)
Yeah, you, if it's not you it's not anyone
(I gotta tell ya, gotta tell ya)
Looking back on my life
You're the only good I've ever done (I've ever done)
Yeah, you, if it's not you, it's not anyone
It's not anyone, not anyone
Oh, oh, oh, oh
If it's not you, it's not anyone
Oh, oh, oh, yeah, whoa
Yeah, you are the only one I'll ever love
(I gotta tell ya, gotta tell ya)
Yeah, you, if it's not you, it's not anyone
(I gotta tell ya, gotta tell ya) gotta tell ya
Looking back on my life
You're the only good I've ever done (ever done, oh, yeah)
Yeah, you, if it's not you, it's not anyone"
"Yeah
Mayne I ain't, I ain't ever had this happen before mayne
Heart breaks so deep
Heart broke so deep, it broke into a melody like this
(Ooh-ooh, ooh-ooh, ooh-ooh)
(Ooh-ooh, ooh-ooh, ooh-ooh)
Aye, aye
She's a runner, she's a track star
She gon' run away when it gets hard
She can't take the pain, she can't get scarred
She hurt anyone that gets involved
Don't wanna commit, why take it this far?
She gon' do the race, just not this one
Love is a game you used to cheer for
When I was down to talk, you weren't here for it
You-ouu-ouu-ouu-ouu (Yoo-ooo-oou)
Leave a trail of heartbreak and heartache like it's cool (cool-ooo-ool)
I guess way too late is convenient for you (yoo-ooo-oou)
The dirt you left don't turn into dust, it don't move (mooo-ooo-ooo-oove)
It's here waiting for you (yooo-ooo-ooo-oou)
Girl you killing me, you tweaking hard
I ask you what you feel and you don't speak at all
But you go straight to Twitter, you gon' tweet it all
You must want another nigga to be alarmed
We were 'posed to fight through the storm
You made a decision, chose the easy one
Say you following your heart, but girl you leaving one
Wanting me to take you back with open reaching arms
I yai yai yai I'm
Lost for words, let it hurt
I yai yai yai I
Put you first, showed you your worth
She's a runner, she's a track star
She gon' run away when it gets hard
She can't take the pain, she can't get scarred
She hurt anyone that gets involved
Don't wanna commit, why take it this far?
She gon' do the race, just not this one
Love is a game you used to cheer for
When I was down to talk, you weren't here for it
You-ouu-ouu-ouu-ouu (yoo-ooo-oou)
Leave a trail of heartbreak and heartache like it's cool (cool-ooo-ool)
I guess way too late is convenient for you (yoo-ooo-oou)
The dirt you left don't turn into dust, it don't move (mooo-ooo-ooo-oove)
It's here waiting for you (yooo-ooo-ooo-oou)
She run from all'f her problems like she in shape for it
Hard times, wait for it and then she break for it
Love don't cost a thing, ashamed how much I paid for it
Love don't cost a thing, ashamed how much I gave for it
Heart broken into pieces, put tape on it
Fragile made out of glass, close the drapes on it
Trust issues OD playing safe on it
Will I ever love again or will I stay lonely?
I yai yai yai I'm
Lost for words, let it hurt
I yai yai yai I
Put you first, showed you your worth
She can't take it
She can't take it
Oh-oh yeah"
"I just looked at my wrist, I got time today
Fuck it, I'm crossin' the line today
The hate be so real, the love be fake
Be bumpin' they gums and bumpin' my tape
Don't go against me then ask for my help
Go get out your feelings and get it yourself
Might got the same shoes but you ain't gon' step (nope)
The shit that you just put out, you could've kept, yep
She got a nigga, he gotta share (why?)
You can't compete when you can't compare (period)
She ate the dick through my underwear (uh)
Got up and got herself out of there
I see they put me on memes and things
Don't speak on my life without knowin' the real
Eight figures a year, what it cost me to live
Don't hold it, just say what you feel but
Watch your mouth 'fore I fly out your bitch (where?)
To a place that she didn't know exist (gone)
Mediterranean, water my wrist (bitch)
Keepin' 'em pissed, how I'm talkin' my shit
Six-figure check for a show, man I'm lit (lit)
Let's celebrate now my bag legit (go)
These niggas with me with whatever I'm with (yeah)
Didn't know who did it, got everybody hit, bitch (brrt)
I don't like niggas, I don't like bitches
I don't like nobody (nobody, nobody)
We can get gangsta, we can keep it cordial
How you wanna go 'bout it? (How you wanna do it?)
I don't backtrack, man, fuck that, I don't miss nobody (I don't miss nothin')
Left it on seen, I ain't write back, I don't trust nobody (period)
I just looked at my wrist, I got time today
Fuck it, I'm crossin' the line today
These bitches'll cry, be lyin' to your face (facts)
Slicker than us, gotta know how they play
If the money wasn't straight, she wouldn't be here today
Ain't it man, sure know what to say
You ain't me so it's hard to relate (what?)
How much cash I fuck off every day (Big Bagg)
Don't play with me, baby, go play with your pussy
You see him in person, these niggas be shookin'
A huncho it cost you a Quavo to book me
I'm worth it, the proof in the pudding
Surrounded by bitches (four of 'em)
I'm lookin' like William but they ain't my girlfriends (nah)
Bruh, I'ma spin on your block back to back
When they finish it look like the world end (dawg)
I ain't ask for it, they did it to me (what?)
Niggas exposin' they hands for free
Get caught in the middle, that's bullseye (get it too)
You got hit but we was targetin' he (him)
Poppin' my shit with a capital P (caps)
SRT, Redeye, red key (vroom)
Might be ugly but my bitch precious (bad)
She ain't even sneeze but still I bless her (achoo)
I don't like niggas, I don't like bitches
I don't like nobody (nobody, nobody)
We can get gangsta, we can keep it cordial
How you wanna go 'bout it? (How you wanna do it?)
I don't backtrack, man, fuck that, I don't miss nobody (I don't miss nothin')
Left it on seen, I ain't write back, I don't trust nobody (period)
I just looked at my wrist, I got time today
Fuck it, I'm crossin' the line today
I just looked at my wrist, I got time today
Fuck it, I'm crossin' the line today
I just looked at my wrist, I got time today
Fuck it, I'm crossin' the line today"
"Real hot girl shit
(d.a. got that dope)
Her friends and mom hate me (go)
Lay down on the bed, do the crybaby (mmm)
She ain't gave me none of that pussy in a while
She had the boy waitin', I don't mind waitin' (come here)
Oh, you ain't gon' respond to my texts? (Oh, yeah?)
Want me keep on my diamonds, we sex? (What's your name?)
Keisha? (Kei), Jasmine? (Jas), Kiera? Megan? (Go)
Lisa? Ashley? (Ashley), Sierra? Sarah?
She got her hands on her knees with her ass in the air
Ooh, that lil' bitch a player
If her friends ain't around to record it
She bend over, shake that lil' ass in the mirror, like
Goddamn, what a nigga gotta do for your number?
Shawty came through with that head so good
I said fuck it, I ain't usin' no rubber
Way she make that ass bounce, think I love her
Got that ass and that mouth from her mother
Type to make your bae mad, you in trouble
NBA playoffs that ass, it's a bubble
Uh-uh (like), uh-uh, come here, come here, uh-uh
Throw that ass back, come here, come here
Her friends and mom hate me (Go)
Lay down on the bed, do the crybaby (Go)
She ain't gave me none of that pussy in a while
She had the boy waitin', I don't mind waitin'
Oh, you ain't gon' respond to my texts? (Oh, yeah?)
Want me keep on my diamonds, we sex? (What's your name?)
Ayy
Real hot girl shit (ayy, ayy)
Lay on my stomach, toot it up, do the crybaby (crybaby)
Look back, hold it open, now he annihilated (yeah)
Moaning like a bitch when he hit this pussy
Damn, he probably wanna wear my hoodie (ah)
Choke me, spank me, look at me, thank me (thank me)
If I give it to another nigga, he'll hate me (he'll hate me)
Spit, slurp, give him that work
Fell too fast for me, now the nigga hurt
Deeper, deeper, I need a reaper
Thought I was in trouble how he tearin' them cheeks up
Keep me a freak, who the flavor of the week?
If I make up the rules, then I don't think it's cheatin'
Jordan, Tommy, Timothy, Daniel (which one?)
Might let Jonathan bring in Sarah (come here, Sarah)
Bitch tryna brag about taking my man (huh?)
Ha, I needed me a nigga off my hands (hahahaha)
Uh-uh, don't fuck me like that, fuck me like this, yeah, ayy
Uh, his friends and his dad hate me (yeah)
I broke his lil' heart, he a crybaby (wah-wah-wah)
If I ain't let him hit the pussy by now
Then that nigga lame if he still waitin' (ah, ah, ah)
I ain't even save your number (nope)
So no, I can't reply to no text (no text)
I make him cry 'bout the pussy, hmm
Probably why my shit so wet (ah, ah, ah, ah, wah, wah, wah)"
"I don't want a lot for Christmas
There is just one thing I need
I don't care about the presents underneath the Christmas tree
I just want you for my own
More than you could ever know
Make my wish come true
All I want for Christmas is you
Yeah
I don't want a lot for Christmas
There is just one thing I need (and I)
Don't care about the presents underneath the Christmas tree
I don't need to hang my stocking there upon the fireplace
Santa Claus won't make me happy with a toy on Christmas Day
I just want you for my own
More than you could ever know
Make my wish come true
All I want for Christmas is you
You, baby
Oh, I won't ask for much this Christmas
I won't even wish for snow (and I)
I'm just gonna keep on waiting underneath the mistletoe
I won't make a list and send it to the North Pole for Saint Nick
I won't even stay awake to hear those magic reindeer click
'Cause I just want you here tonight
Holding on to me so tight
What more can I do?
Oh, baby, all I want for Christmas is you
You, baby
Oh-oh, all the lights are shining so brightly everywhere (so brightly, baby)
And the sound of children's laughter fills the air (oh, oh, yeah)
And everyone is singing (oh, yeah)
I hear those sleigh bells ringing
Santa, won't you bring me the one I really need? (Yeah, oh)
Won't you please bring my baby to me?
Oh, I don't want a lot for Christmas
This is all I'm asking for
I just wanna see my baby standing right outside my door
Oh, I just want you for my own
More than you could ever know
Make my wish come true
Oh, baby, all I want for Christmas is you
You, baby
All I want for Christmas is you, baby
All I want for Christmas is you, baby
All I want for Christmas is you, baby
All I want for Christmas (all I really want) is you, baby
All I want (I want) for Christmas (all I really want) is you, baby"
"Yeah
They wanna eat off my plate
They wanna eat off me
When I had my vision you couldn't see it
I'm off to better things
I'm only doing shit that's gonna make me elevate
Only want people around that's gonna make me better
Bitch, pull up in that mhm
It's a mhm
They ask how I get that ooh
I'm too busy getting this money, counting this cheddar
My daddy let me down but I promise you I won't let up
I wanna say fuck that man
But this shit won't make me better
Me and my brother still beefin' right now
'Cause he ain't get that letter
Numb to the pain
Yeah, and I'm like yeah
Fuck everybody, I can't trust nobody
I ain't even really tryna party
Don't invite me to no party
Bitch pull up in that mhm
It's a mhm
They ask how I get that ooh
I'm a hustler, baby (yeah)
You must not know me, baby
I'm off to better things
I'm only doing shit that's gonna make me elevate
Only want people around that's gonna make me better
Bitch, pull up in that mhm
It's so ooh, mhm
They ask how I get that ooh
Can't worry 'bout nobody
Gotta worry about my business
Don't bring them niggas around me
I don't know they intentions
Don't wanna fall in love 'cause these lil' niggas trippin'
That's why I stay out the way gotta make sure I keep my distance
Why they wanna hate me
This shit crazy
She mad I took her nigga, ooh
That's my bussit baby, ooh yeah
You must not know me baby
Hehehe
I'm off to better things
I'm only doing shit that's gonna make me elevate
Only want people around that's gonna make me better
Bitch, pull up in that mhm
It's so ooh, mhm
They ask how I get that ooh
Bitch, pull up in that mhm
It's so ooh, mhm
They ask how I get that ooh"
"Did you grow up on a tractor?
Did your daddy let you drive?
Are you whiskey bent and hell bound
Even though your mama tried?
Did you cruise down a backroad
With your Dixieland delight?
Are you on the Chattahoochee
On a barefoot blue jean night?
Everybody got a small town anthem
Everybody got a story to tell
Everybody got a hallelujah
Everybody been through a little hell
When you're rolling down a two-lane highway
And you turn your radio on
Tell me which one hits you, baby
Yeah, what's your country song?
Yeah, what's your country song?
Do your exes live in Texas?
Are you so lonesome you could cry?
Are you heartbroke 'cause you know
That ain't your truck in her drive?
Are your friends all in low places
Underneath the neon moon?
Were you already country
Back when country wasn't cool?
Everybody got a small town anthem
Everybody got a story to tell
Everybody got a hallelujah
Everybody been through a little hell
When you're rolling down a two-lane highway
And you turn your radio on
Tell me which one hits you, baby
Yeah, what's your country song?
Yeah, what's your country song?
Who's your strawberry wine?
What's your family tradition?
What makes you turn it up
Make you raise your cup every time you listen?
Everybody got a small town anthem
Everybody got a story to tell
Everybody got a hallelujah
Everybody been through a little hell
When you're rolling down a two-lane highway
And you turn your radio on
Tell me which one hits you, baby
Yeah, what's your country song?
Yeah, what's your country song?"
"Yeah, yeah
I don't remember much about last night
Woke up on a couch sunrise
Saw the living room
Through these bloodshot eyes of mine
Cold sober
You didn't like that I come home late
4 a.m. but it's a Friday, babe
And I've been working hard
Can't you give me some space
'Stead of shouting out, ""Oh my God""
Whoa, oh yeah
Whoa, oh yeah
I go out with some new friends
But it just makes me miss you more
More
I spend all my money drinking on my own, yeah
In this bar, just sat here staring at my phone
And I keep second-guessing where did I go wrong?
I know I'm proud
But I've had one too many
Come take me home
So now I'm the one that's crying
I didn't wanna call 'cause I didn't wanna fight
I swear that I was trying, yeah
But everybody falls when their head's a little high
And I've never meant to get so out my mind
With you playing cool, just pretending it's fine
Oh, we've been 'round, 'round, 'round this
Too many times before
Whoa, oh yeah
Whoa, oh yeah
I go out with some new friends
But it just makes me miss you more
More
I spend all my money drinking on my own, yeah
In this bar, just sat here staring at my phone
And I keep second-guessing where did I go wrong?
I know I'm proud
But I've had one too many
Come take me home
I don't know how lucky
How lucky I am, I am, I am, no
I guess sometimes I should give more of a damn
A damn, a damn about you
I don't know how lucky
How lucky I am, I am, I am, no
I know we're both stubborn
Push each other's buttons
I'd rather do it with you, but
I spend all my money drinking on my own, yeah
In this bar, just sat here staring at my phone
I spend all my money drinking on my own, yeah
In this bar, just sat here staring at my phone, yeah
And I keep second-guessing where did I go wrong?
I know I'm proud
But I've had one too many
Come take me home
Come take me home
Yeah, I've had one too many"
