"Up, up
Up (ayy), up (uh)
Up, look (this is fire)
Once upon a time, man, I heard that I was ugly
Came from a bitch who nigga wanna fuck on me
I said my face bomb, ass tight
Racks stack up Shaq height
Jewelry on me, flashlight
I been lit since last night
Hit him with that good-good
Make a nigga act right
Broke boys don't deserve no pussy (I know that's right!)
Big bag bussin' out the Bentley Bentayga
Man, Balenciaga Bardi back and all these bitches fucked
It's big bags bussin' out the Bentley Bentayga, man
Birkin bag, Bardi back and all you bitches fucked
If it's up, then it's up, then it's up, then it's stuck
If it's up, then it's up, then it's up, then it's stuck, huh (ayy)
Up, then it's up, if it's up, then it's stuck (huh)
If it's up, then it's up, then it's up, then it's stuck, huh (woo)
I could make the party hot, I could make your body rock
Bitches say they fuckin' with me, chances are they probably not
If I had a dick, you'd probably lick it like a lollipop
Hoes speakin' Cap-enese, hit 'em with karate chop
I'm forever poppin' shit, pullin' up and droppin' shit
Gotta argue with him 'cause a nigga love a toxic bitch
Niggas out here playin', gotta make 'em understand
If ain't no ring on my finger, you ain't goin' on my 'Gram
I said my face bomb, ass tight
Racks stack up Shaq height (yeah)
Jewelry on me, flashlight (huh)
I been lit since last night (woo)
Hit him with that good-good
Make a nigga act right (ah)
Broke boys don't deserve no pussy (I know that's right!)
Big bag bussin' out the Bentley Bentayga
Man, Balenciaga Bardi back and all these bitches fucked (woo)
It's big bags bussin' out the Bentley Bentayga, man
Birkin bag, Bardi back and all you bitches fucked (woo)
If it's up, then it's up, then it's up, then it's stuck
If it's up, then it's up, then it's up, then it's stuck, huh (ayy)
Up, then it's up, if it's up, then it's stuck
If it's up, then it's up, then it's up, then it's stuck, huh (bitch)
Bitches ain't fuckin' with me now and I can see why
Dirty-ass, dusty-ass bitch, you got pink eye
Bitches want smoke until I bring it to they doorstep
Tell that bitch, ""Back, back, "" breath smell like horse sex (ha)
Put it on him now, he will never be the same (he won't)
Tatt'ed on my ass 'cause I really like the pain (ah)
He nutted on my butt, I said, ""I'm glad that you came""
If that nigga had a twin, I would let 'em run a train, woo (skrrt)
Big bag bussin' out the Bentley Bentayga
Man, Balenciaga Bardi back and all these bitches fucked (woo)
It's big bags bussin' out the Bentley Bentayga, man
Birkin bag, Bardi back and all you bitches fucked (ooh)
If it's up, then it's up, then it's up, then it's stuck
If it's up, then it's up, then it's up, then it's stuck, huh (woo)
Up, then it's up, if it's up, then it's stuck (woo)
If it's up, then it's up, then it's up, then it's stuck, huh
Look, gotta play it safe, huh
No face, no case (hahaha)"
"Ayy
My girl is bangin'
She's so low maintenance
Don't need no champagne poppin' entertainment
Take her to Wendy's
Can't keep her off me
She wanna dip me like them fries in her Frosty
But every now and then when I get paid
I gotta spoil my baby with an upgrade (ayy)
Ayy, ayy, ayy
Yeah, we fancy like Applebee's on a date night
Got that Bourbon Street steak with the Oreo shake
Get some whipped cream on the top too
Two straws, one check, girl, I got you
Bougie like Natty in the styrofoam
Squeak-squeakin' in the truck bed all the way home
Some Alabama-jamma, she my Dixieland delight (ayy)
That's how we do, how we do, fancy like, oh
Fancy like, oh
Fancy like, oh
Fancy like, oh
Uh, don't need no Tesla (don't need no Tesla) to impress her (to impress her)
My girl is happy rollin' on a Vespa (there she go)
Don't need no mansion (ooh) to get romancin' (woo)
She's super fine, double wide, slow dancin' (slow dancin')
But every now and then when I get paid
I gotta spoil my baby with an upgrade
Ayy, ayy, ayy
Yeah, we fancy like Applebee's on a date night (that's right)
Got that Bourbon Street steak with the Oreo shake (ayy)
Get some whipped cream on the top too (gotta add that whipped cream)
Two straws, one check, girl, I got you (girl, I got you)
Bougie like Natty in the styrofoam (styrofoam)
Squeak-squeakin' in the truck bed all the way home (all the way home)
Some Alabama-jamma, she my Dixieland delight (ayy)
That's how we do, how we do, fancy like
My new, clean blue jeans without the holes in 'em
Country kisses on my lips without the Skoal in 'em
Yeah, she probably gon' be keeping some Victoria's Secrets
Maybe a little Maybelline but she don't need it
In the kitchen light radio slows down
Boxed wine and her up-do goes down
Ayy
Yeah, we fancy like Applebee's on a date night (that's right)
Got that Bourbon Street steak with the Oreo shake (ayy)
Get some whipped cream on the top too (gotta add that whipped cream)
Two straws, one check, girl, I got you
Bougie like Natty in the styrofoam (styrofoam)
Squeak-squeakin' in the truck bed all the way home (all the way home)
Some Alabama-jamma, she my Dixieland delight (ayy)
That's how we do, how we do, fancy like"
"Baby, ya yo me enteré, se nota cuando me ve'
Ahí donde no has llegao' sabes que yo te llevaré
Y dime qué quieres beber, es que tú eres mi bebé
¿Y de nosotros quién va a hablar? Si no nos dejamos ver
Y a veces es Dolce, a veces Bulgari
Cuando te lo quito después de los parties
Las copas de vino, las libras de mari
Tú estás bien suelta, yo de safari
Tú mueve' el culo fenomenal
Pa' yo devorarte como animal
Si no te has vení'o, yo te vo' a esperar
En mi cama y lo vo' a celebrar
Baby, a ti no me opongo
Y siempre te lo pongo
Y si tú me tiras, vamo' a nadar en lo hondo
Si es por mí te lo pongo
De septiembre hasta agosto
A mí sin cojone' lo que digan tus amigas
Ya yo me enteré, se nota cuando me ve'
Ahí donde no has llegao' sabes que yo te llevaré
Y dime qué quieres beber, es que tú eres mi bebé
¿Y de nosotros quién va a hablar? Si no nos dejamos ver (¿me sigues?)
Mami, me tienes juqueao', sí
Si fueras la Uru, me tuvieses parqueao'
Dando vueltas por Condado, contigo siempre arrebatao'
Tú no eres mi señora, pero
Toma cinco mil, gástalo en Sephora
Louis Vuitton, ya no compra en Pandora
Como piercing a los hombres perfora, eh-eh-eh
Hace tiempo le rompieron el cora (el cora)
Estudiosa, puesta pa' ser doctora (doctora)
Pero (pero), le gustan los títeres wheeleando motoras (motoras)
Yo estoy pa' ti las veinticuatro hora'
Baby, a ti no me opongo
Y siempre te lo pongo (-pre te lo pongo)
Y si tú me tiras, vamo' a nadar en lo hondo (nadar en lo hondo)
Si es por mí te lo pongo
De septiembre hasta agosto
Y a mí sin cojone' lo que digan tus amigas
Ya yo me enteré, se nota cuando me ve'
Ahí donde no has llegao' sabes que yo te llevaré
Y dime qué quieres beber, es que tú eres mi bebé
¿Y de nosotros quién va a hablar? Si no nos dejamos ver
Y a veces es Dolce, a veces Bulgari
Cuando te lo quito después de los parties
Las copas de vino, las libras de mari
Tú estás bien suelta, yo de safari
Tú mueve' el culo fenomenal
Pa' yo devorarte como animal
Si no te has vení'o, yo te vo' a esperar
En mi cama y lo vo' a celebrar"
"That my best friend, she a real bad bitch
Got her own money, she 'on't need no nig'
On the dance floor, she had two-three drinks
Now she twerkin', she throw it out and come back in
That's my best friend, she a real bad bitch
Drive her own car, she 'on't need no Lyft
In the strip club, know my girl gon' tip
Now she twerkin', she throw it out and come back in
Beep-beep, is that my bestie in a Tessie?
Fresh blow out, skin on tan, ooh, she ready
Bitch, you look goodt, with a T at the end
I'ma hype her every time, that my motherfuckin' friend
She been down since the jellies and the Volvos
Got me steppin' out that Jeep, got Manolo's
When we pull up to the scene, they be filled with jealousy
If a bitch get finicky, she gon' bring that energy (pop-pop-pop)
I hit her phone with the tea, like, ""Bitch, guess what?""
All the rich ass boys wanna fuck on us
All this ass sittin' up, you can look, don't touch
In our bag, bust some bands every time we link up
That my best friend, she a real bad bitch
Got her own money, she 'on't need no nig'
On the dance floor, she had two, three drinks
Now she twerkin', she throw it out and come back in
That's my best friend, she a real bad bitch
Drive her own car, she 'on't need no Lyft
In the strip club, know my girl gon' tip
Now she twerkin', she throw it out and come back in
That my best friend, if you need a freak
I ain't dumb, but motherfucker, she my Tweedledee
If she ride for me (ride), she 'on't need a key
If you sideways, she'll straighten you if need to be
And she so bad that I just can't take that bitch nowhere
She off her fifth shot, said, ""Mmm-mmm, don't go there""
Bitch, break her back, she protect and attack
Get that strap like them buckle, foot on neck, give no air
Whole world wanna be us
And my main bitch, she my day-one
On my way, bitch, let you get drunk
Let's celebrate 'cause we the baddest in the club
That my best friend, she a real bad bitch
Got her own money, she 'on't need no nig'
On the dance floor, she had two, three drinks
Now she twerkin', she throw it out and come back in
That's my best friend, she a real bad bitch
Drive her own car, she 'on't need no Lyft
In the strip club, know my girl gon' tip
Now she twerkin', she throw it out and come back in
Ha, best friend, you the baddest and you know it (you know)
Uh-oh, girl, I think our booty growin' (ayy-yeah)
Fuck it up in the mirror, hit them poses (pose)
Best friend, damn, you motherfuckin' glowin' (woo-woo)
Best friend, damn, your wrist look like it's frozen (it's frozen)
Uh-oh, girl, I think our booty growin' (uh-oh)
Fuck it up in the mirror, hit them poses (hit that pose)
Best friend, you my motherfuckin' soulmate"
"Uh (Tuned up)
Copped a BMW, new deposit, I picked up another bag
Like, ""Fuck it, I'ma count while I'm in it""
I hear planes flyin', crowds screamin', money counters, chains clangin'
Shit, I guess that's how it sound when you winnin'
I ain't jokin', do it sound like I'm kiddin'?
I've been makin' like two thousand a minute
So high up through the clouds, I was swimmin'
I'm probably gon' drown when I'm in it
I bet she gon' get loud when I'm in it
And we might have a child when I'm finished
Uh, I won't love a ho, after we fuck she can't get near me
Only bitch I give a conversation to is Siri
My pants Amiri, yes, I'm winnin', clearly
I'm the chosen one, seen my potential so they fear me
Lately, I've been prayin', God, I wonder, can you hear me?
Thinkin' 'bout the old me, I swear I miss you dearly
Stay down 'til you come up, I've been stickin' to that theory
Every day a battle, I'm exhausted and I'm weary
Make sure I smile in public, when alone, my eyes teary
I fought through it all, but that shit hurt me severely
I've been gettin' high to hide behind my insecurities
Takin' different pills but I know it ain't gon'
Uh, copped a BMW, new deposit, I picked up another bag
Like, ""Fuck it, I'ma count while I'm in it""
I hear planes flyin', crowds screamin', money counters, chains clangin'
Shit, I guess that's how it sound when you winnin'
I ain't jokin', do it sound like I'm kiddin'?
I've been makin' like two thousand a minute
So high up through the clouds, I was swimmin'
I'm probably gon' drown when I'm in it
I bet she gon' get loud when I'm in it (uh, uh)
And we might have a child when I'm finished
They say I'm Pac rebirth, never put out a weak verse
Homicides when we lurk, I'ma step 'til my feet hurt
Been puttin' them streets first
White tees turned burgundy T-shirts
Lookin' for somethin' real, he stuck in a deep search
Anxiety killin' me, I just wanna leave Earth
When they ask if I'm okay, it just make everything seem worse
Tryna explain your feelings sound like something you rehearsed
Stabbed me in my back with a clean smirk
Lookin' so deep into your eyes, I can read your thoughts, so
Shut the fuck, I mean, please don't talk
I done been through too much and I don't need another loss
Put that on every war scar, for every battle I fought
Uh, copped a BMW, new deposit, I picked up another bag
Like, ""Fuck it, I'ma count while I'm in it""
I hear planes flyin', crowds screamin', money counters, chains clangin'
Shit, I guess that's how it sound when you winnin'
I ain't jokin', do it sound like I'm kiddin'?
I've been makin' like two thousand a minute
So high up through the clouds, I was swimmin'
I'm probably gon' drown when I'm in it
I bet she gon' get loud when I'm in it
And we might have a child when I'm finished
When I'm finished
When I'm finished"
"Ooh
Balloons are deflated
Guess they look lifeless like me
We miss you on your side of the bed, mmm
Still got your things here
And they stare at me like souvenirs
Don't wanna let you out my head
Just like the day that I met you
The day I thought forever
Said that you love me
But that'll last for never
It's cold outside
Like when you walked out my life
Why you walk out my life?
I get like this every time
On these days that feel like you and me
Heartbreak anniversary
'Cause I remember every time
On these days that feel like you and me
Heartbreak anniversary
Do you ever think of me?
no
(Ooh) no-no, no
(Ooh, ooh, ooh) ooh, nah
I'm buildin' my hopes up
Like presents unopened 'til this day
I still see the messages you read, mmm
I'm foolishly patient
(Foolishly patient)
Can't get past the taste of your lips
(Taste of your lips)
Don't wanna let you out my head
Just like the day that I met you
The day I thought forever
Said that you love me
But that'll last for never
It's cold outside
Like when you walked out my life
Why you walk out my life? (My life)
I get like this every time
On these days that feel like you and me
Heartbreak anniversary
'Cause I remember every time
On these days that feel like you and me
Heartbreak anniversary
Do you ever think of me?
of me
'Cause I think of you, think of you"
"CashMoneyAP
Get 'em, get 'em, get 'em, oh
Oh (I'm tryna fuckin' get 'em), oh (I'm tryna fuckin' get 'em)
Oh, oh (get 'em), oh
Oh (gettin' big on this), oh, oh, oh
Oh, oh, oh, oh
Oh, oh, oh
What do you want? Won't tell you twice, yeah
I'm a thief in the night (thief in the night), oh
I did some wrongs (oh, oh), but I'm always right (oh, oh)
Said, ""I know how to shoot"" (oh), and I know how to fight
If I tell you once, won't tell you twice
I'm real discreet, like a thief in the night
Look, if I call you bae, you bae for the day
Or bae for the night, you not my wife
She want a killer to fuck all night
I wanna fuck on a thot, gimme head all night
AP, big rocks, in the hood with the 'rillas
Five K on the dinner, bring 300 thou' to the dealer
I did some wrongs (oh, oh), but I'm always right (oh, oh)
Said, ""I know how to shoot"" (oh), and I know how to fight
If I tell you once, won't tell you twice
I'm real discreet, like a thief in the night
Baby
I'm rich but I'm ridin' and I'm low on exotic
I'm 'bout to fly out and go get me some
Nothin' ain't seen, all this money on me
Hunnid racks in the bag, that's a honey bun
Baby OG, I been runnin' these streets
Got the game fully shine on my momma's son
Learn 'bout the triple cross when I was young
And I know I ain't goin' so I keep a gun
I flew to Paris just to buy some Dior
She beggin' for attention, I don't see her
C.I.P. Pop, I wish that you could see us
Million cash plus whenever I go re-up
I got some niggas in the street, wanna beat me
I got the industry tryna be me
I just go Ray Charles, they can't see me
I'm in the Rolls Royce with a RiRi
I did some wrongs (oh, oh), but I'm always right (oh, oh)
Said, ""I know how to shoot"" (oh), and I know how to fight
If I tell you once, won't tell you twice
I'm real discreet, like a thief in the night
Yeah, like a thief in the night (thief)
I pull up, give her D for the night (uh-huh)
Tryna fuck in the V, it's aight (let's fuck)
We can't fuck up my seats 'cause they white
(That's my seats, watch my motherfuckin' seats)
I'm livin' like Thriller, I only come out at the night time
She don't fuck with liquor, don't like bein' tipsy
She don't do the Henny, just white wine (what she do?)
Pop the cork on some new Pinot Grigio (yeah)
I pull up in the Porsche wit' a freaky hoe (zoom)
Park the Porsche and pull up in a Lambo' (hmph)
I hop out, Major Payne, rockin' camo (yessir)
Think she cute, make her fuck, watch her man go (she cute)
Like to shoot, light you up, bitch, I'm Rambo
Cuban link full of rocks, it's a choker (oh)
Rest in peace to the Pop, make me smoke ya
I did some wrongs (oh), but I'm always right (oh, oh)
Said, ""I know how to shoot"" (oh), and I know how to fight
If I tell you once, won't tell you twice
I'm real discreet, like a thief in the night"
"Steady callin' my phone
I done told you before that it's over, leave me 'lone
Know it's hurtin' you to see me gone
Dark clouds, you gon' see me storm
I won't go back
But trust me, you're gon' hold that
Hold that (mmh, mmh)
Get you off my mind now
I can't get you off my mind now
I can't get you off my mind now
I can't get you off my mind now (mmh, mmh)
I can't get you off my mind now
I can't get you off my mind now
I can't get you off my mind now
I can't get you off my mind now (mmh, mmh)
I ain't tryna play these game no more
I don't wanna be textin' your name no more
I ain't tryna feel this pain no more
And I'm sorry but my feelings ain't the same no more (no)
Used to be my homie, you ain't gang no more (no)
I am not a nigga you could claim you no more (no)
Traumatized, hoping it don't rain no more
You done put me through some things that done changed my aura
Now all around the world, I explore, no Dora
New bitch, I might drip out and Dior her
Ass fat, shawty straight heat, no Florida
Bad and she know it, for herself, I applaud her
No needs, yeah, I'm talkin' my boo
So please, leave 'lone, I'm through
And it's all 'cause of what you started
I been told you I won't lose (mmh)
Steady callin' my phone (brrt)
I done told you before that it's over, leave me 'lone
Know it's hurtin' you to see me gone
Dark clouds, you gon' see me storm
I won't go back (go back)
But trust me, you're gon' hold that
Hold that (mmh, mmh)
Get you off my mind now (ooh, wow)
I can't get you off my mind now (yeah, yeah)
I can't get you off my mind now (my mind)
I can't get you off my mind now (mmh, mmh, alright)
I can't get you off my mind now (whoa)
I can't get you off my mind now (whoa)
I can't get you off my mind now (yeah)
I can't get you off my mind now (mmh, mmh)
I ain't tryna play no games, my love
I'm one of a kind, couldn't fake, my love
Earthquake, make somethin' shake, my love
Most of 'em can't even relate, my love
Used to be gang, oh, now you're not gang
Used to have fun, no, now you got shame
Used to catch flights but now I'm not playin'
Play on words, she love it when a nigga sing
I ain't tryna play your game no more
No, you can't wear my chain no more
We are not a thing, can't take no more
Waitin' on your king, you could wait some more
'Cause yeah, I remember days when I used to adore her
Funny how this shit just flipped like a quarter
Get a new thing, I'ma Fendi and Dior her
Get a mood swing, I'll be gone by tomorrow
Steady callin' my phone (brrt)
I done told you before that it's over, leave me 'lone
Know it's hurtin' you to see me gone
Dark clouds, you gon' see me storm
I won't go back (I won't go back, no)
But trust me, you're gon' hold that (hold that)
Hold that (mmh, mmh)
Get you off my mind now (mind)
I can't get you off my mind now (mind)
I can't get you off my mind now (mind)
I can't get you off my mind now (mmh, mmh, mind)
I can't get you off my mind now (mind)
I can't get you off my mind now (mind)
I can't get you off my mind now (yeah)
I can't get you off my mind now( mmh, mmh)
I can't"
"It's beautiful, it's bittersweet
You're like a broken home to me
I take a shot of memories
And black out like an empty street
I fill my days with the way you walk
And fill my nights with broken dreams
I make up lies inside my head
Like one day you'll come back to me
Now I'm not holdin' on, not holdin' on
I'm just depressed that you're gone
Not holdin' on, not holdin' on
Beautiful mistakes, I make inside my head
She's naked in my bed
And now we lie awake, makin' beautiful mistakes
I wouldn't take 'em back
I'm in love with the past
And now we lie awake, makin' beautiful mistakes
Nah-nah-nah, in my head
Nah-nah-nah, in my bed
Nah-nah-nah, ayy
Makin' beautiful mistakes
It's pitiful, I can't believe
How every day gets worse for me (yeah, yeah)
I take a break, I cut you off
To keep myself from lookin' soft
I fill my nights with the way you was
And still wake up with broken dreams
I make these lies inside my head
Feel like they're my reality
Now I'm not holdin' on, not holdin' on
I'm just depressed that you're gone
Not holdin' on, not holdin' on
Beautiful mistakes, I make inside my head
She's naked in my bed
And now we lie awake, makin' beautiful mistakes
I wouldn't take 'em back
I'm in love with the past
And now we lie awake, makin' beautiful mistakes
Nah-nah-nah, in my head
Nah-nah-nah, in my bed
Nah-nah-nah, yeah, yeah
Makin' beautiful mistakes
You did me wrong 'cause I let you (let you)
Usually, I like my situations beneficial
Doin' somethin' different, got me lookin' stupid (damn)
The only way I'm comin' back to you is if you dreamin', lucid
Prove it, if you made a promise then keep it (keep it)
Why you wanna lie and then get mad? I don't believe it (boy, bye)
But really I was doin' just fine without ya
Lookin' fine, sippin' wine, dancin' on club couches (ah)
Baby, why you wanna lose me like you don't need me? (Like you don't need me)
Like I don't block you and you still try to reach me (still try to reach me)
How you figure out how to call me from the TV? (Huh?)
You runnin' outta chances and this time I mean it (ah)
Yeah, bet you miss my love all in your bed (bed)
Now you're stressin' out, pullin' your hair (hair)
Smellin' your pillows and wishin' I was there (I was there)
Slidin' down the shower wall, lookin' sad (sad)
I know it's hard to let go, I'm the best (I'm the best)
Best you ever had and best you gon' get (gon' get)
And if we break up, I don't wanna be friends (be friends)
You're toxic
Beautiful mistakes, I make inside my head
She's naked in my bed
And now we lie awake, makin' beautiful mistakes
I wouldn't take 'em back
I'm in love with the past
And now we lie awake, makin' beautiful mistakes
Nah-nah-nah, in my head
Nah-nah-nah, in my bed
Nah-nah-nah, yeah, yeah (oh)
Makin' beautiful mistakes
Nah-nah-nah, in my head
Nah-nah-nah, in my bed
Nah-nah-nah, hey (let it go)
Makin' beautiful mistakes
Nah-nah-nah
Nah-nah-nah (ooh)
Nah-nah-nah"
"I hear a lot about sinners
Don't think that I'll be a saint
But I might go down to the river, uh
'Cause the way that the sky opens up when we touch
Yeah, it's makin' me say
That the way you hold me, hold me, hold me, hold me, hold me
Feels so holy, holy, holy, holy, holy
On God
Runnin' to the altar like a track star
Can't wait another second
'Cause the way you hold me, hold me, hold me, hold me, hold me
Feels so holy
I don't do well with the drama
And no, I can't stand it bein' fake
No, no, no, no, no, no-no-no
I don't believe in nirvana
But the way that we love in the night gave me life
Baby, I can't explain
That the way you hold me, hold me, hold me, hold me, hold me
Feels so holy, holy, holy, holy, holy
On God
Runnin' to the altar like a track star
Can't wait another second
'Cause the way you hold me, hold me, hold me, hold me, hold me
Feels so holy
They say we're too young and
The pimps and the players say, ""Don't go crushin'""
Wise men say, ""Fools rush in""
But I don't know (ah-ah, ah, ah)
They say we're too young and
The pimps and the players say, ""Don't go crushin'""
Wise men say, ""Fools rush in""
But I don't know (Chance the Rapper, ah)
The first step pleases the Father
Might be the hardest to take
But when you come out of the water
I'm a believer, my heart is fleshy
Life is short with a temper like Joe Pesci
They always come and sing your praises, your name is catchy
But they don't see you how I see you, Parlay and Desi
Cross, Tween, Tween, Hesi' hit the jet speed
When they get messy, go lefty, like Lionel Messi
Let's take a trip and get the Vespas or rent a jet-ski
I know the spots that got the best weed, we goin' next week
I wanna honor, wanna honor you
Bride's groom, I'm my father's child
I know when the son takes the first steps, the Father's proud
If you make it to the water He'll part the clouds
I know He made you a snack like Oscar Proud
Suffer it to be so now gotta clean it up
Formalize the union in communion He can trust
I know I ain't leavin' you like I know He ain't leavin' us
I know we believe in God and I know God believes in us
'Cause the way you hold me, hold me, hold me, hold me, hold me
Feels so holy, holy, holy, holy, holy
On God
Runnin' to the altar like a track star
Can't wait another second
On God
Runnin' to the altar like a track star
Can't wait another second
On God
Runnin' to the altar like a track star
Can't wait another second
'Cause the way you hold me, hold me, hold me, hold me
Feels so holy"
